orig_label,count,short_label,TN,order
Scopri come la scienza aiuta a riconoscere e prevenire la fragilità.,451,Scienza e prevenzione della fragilità,1,1
Esplora come la prevenzione diventa azione per mantenere autonomia e salute.,69,Prevenzione e autonomia nella salute,1,2
Scopri come gli spazi e le tecnologie sostengono l’autonomia quotidiana.,139,"Spazi, tecnologie e autonomia",1,3
Scopri come dall’ambiente si passa al benessere di corpo e mente.,73,Ambiente e benessere psicofisico,1,4
Scopri come i cambiamenti demografici influenzano i bisogni di cura e di welfare.,184,"Demografia, cura e welfare",2,1
"Esplora come lavoro, salute e benessere si intrecciano in una società che invecchia.",119,"Lavoro, salute e benessere nell’invecchiamento",2,2
Scopri come il lavoro che cambia ridefinisce i rapporti tra generazioni.,38,Lavoro e relazioni intergenerazionali,2,3
Esplora come le sfide tra generazioni si traducono in politiche per una longevità equa e sostenibile.,54,Politiche per una longevità equa,2,4





